<?xml version="1.0" encoding="GB2312"?>
<?xml-stylesheet type="text/xsl" href="alldata.xsl"?>
<!DOCTYPE root SYSTEM "anime.dtd">
<root xmlns:xsi="http://www.w3.org/2001/XMLSchema-instance"    
      xsi:noNamespaceSchemaLocation="third.xsd">
<section section_id="36">
<!--36 编写人：邹仕艺-->
  <origin country="中国">
   <anime anime_name="熊出没">
    <anime_content>第一季第1集</anime_content>
    <producer producer_name="深圳华强数字动漫有限公司">爱奇艺乐视网</producer>
   </anime>
   <original form="漫画">
    <author author_name="丁亮" author_gender="男" author_birth="1973-05-18"/>
   </original>
  </origin>
  <roletable>
   <role role_name="熊大" role_gender="男" role_age="19" role_cv="张伟">
    狗熊
   </role> 
   <role role_name="熊二" role_gender="男" role_age="17" role_cv="张秉君">
    狗熊
   </role>
   <role role_name="光头强" role_gender="男" role_age="35" role_cv="谭笑">
    狗熊
   </role>
  </roletable>
  <plot plot_classifier="日常">
   <plot_content>  光头强带着电锯和枪来到风景优美的森林里伐木，森林的主人是两只狗熊，它们是熊大熊二。光头强要砍树，狗熊兄弟要阻止破坏森林的行为，光头强和两只臭狗熊之间围绕着保护森林这个主题展开。
   </plot_content>
   <linestable>
    <lines lines_id="1">
    <speaker>光头强</speaker>
    <linestext keyword="有趣">
     这头熊真有趣
    </linestext>
    </lines>
    <lines lines_id="2">
    <speaker>光头强</speaker>
    <linestext keyword="整片森林">
     不错不错，说不定这头熊还能帮着我砍树呢。哈哈哈哈哈，这整片森林都是我的了！
    </linestext>
    </lines>
   </linestable>
  </plot>
  <frames frames_classifier="萌系">
   熊二初次遇见光头强，被人类的美食所迷住，很可爱。
  </frames>
 </section>
 
 <section section_id="37">
  <!--37 编写人：邹仕艺-->
  <origin country="中国">
   <anime anime_name="熊出没">
    <anime_content>第一季第2集</anime_content>
    <producer producer_name="深圳华强数字动漫有限公司">爱奇艺乐视网</producer>
   </anime>
   <original form="漫画">
    <author author_name="丁亮" author_gender="男" author_birth="1973-05-18"/>
   </original>
  </origin>
  <roletable>
   <role role_name="熊大" role_gender="男" role_age="19" role_cv="张伟">
    狗熊
   </role> 
   <role role_name="熊二" role_gender="男" role_age="17" role_cv="张秉君">
    狗熊
   </role>
   <role role_name="光头强" role_gender="男" role_age="35" role_cv="谭笑">
    狗熊
   </role>
  </roletable>
  <plot plot_classifier="日常">
   <plot_content>  光头强和森林保护者熊兄弟之间上演熊熊的歌声。
   </plot_content>
   <linestable>
    <lines lines_id="1">
    <speaker>熊大</speaker>
    <linestext keyword="果然">
     果然又是光头强
    </linestext>
    </lines>    
   </linestable>
  </plot>
  <frames frames_classifier="萌系">
   熊二和熊大在认真的学习唱歌，却被光头强的电锯声所干扰。
  </frames>
 </section>

 <section section_id="38">
  <!--38 编写人：邹仕艺-->
  <origin country="中国">
   <anime anime_name="熊出没">
    <anime_content>第一季第3集</anime_content>
    <producer producer_name="深圳华强数字动漫有限公司">爱奇艺乐视网</producer>
   </anime>
   <original form="漫画">
    <author author_name="丁亮" author_gender="男" author_birth="1973-05-18"/>
   </original>
  </origin>
  <roletable>
   <role role_name="熊大" role_gender="男" role_age="19" role_cv="张伟">
    狗熊
   </role> 
   <role role_name="熊二" role_gender="男" role_age="17" role_cv="张秉君">
    狗熊
   </role>
   <role role_name="光头强" role_gender="男" role_age="35" role_cv="谭笑">
    狗熊
   </role>
  </roletable>
  <plot plot_classifier="日常">
   <plot_content>  
   伐木工光头强和两只熊的斗争，光头强要砍伐森林，熊大熊二要保护森林家园，在第五集中光头强买了一个机器人代替人工伐木。
   </plot_content>
   <linestable>
    <lines lines_id="1">
    <speaker>光头强</speaker>
    <linestext keyword="办法">
     都怪那两头小熊熊，每次都跑出来捣乱。可是，可是那又有什么办法呢？
    </linestext>
    </lines>    
   </linestable>
  </plot>
  <frames frames_classifier="萌系">
   光头强砍树又被熊大熊二所阻挠，气急败坏，抓耳挠腮很可爱。
  </frames>
 </section>
 
 <section section_id="39">
 <!--39 编写人：邹仕艺-->
  <origin country="中国">
   <anime anime_name="大耳朵图图">
    <anime_content>第一季第1集</anime_content>
    <producer producer_name=" 上海美术电影制片厂">腾讯视频</producer>
   </anime>
   <original form="漫画">
    <author author_name="速达" author_gender="男" author_birth="1983-12-18"/>
   </original>
  </origin>
  <roletable>
   <role role_name="胡图图" role_gender="男" role_age="3" role_cv="豆豆" />
    狗熊
  </roletable>
  <plot plot_classifier="日常">
   <plot_content>    图图和小美讨论孩子是从哪里来的，壮壮得意地告诉他们小孩子是商店里买来的。图图回家告诉了妈妈后，妈妈无奈的说孩子是医院的“魔术师”从妈妈肚子里变出来的。丁玎阿姨要生小宝宝了，图图吵着跟妈妈去医院看孩子，却闹出让医生哭笑不得的笑话。
   </plot_content>
   <linestable>
    <lines lines_id="1">
    <speaker>胡图图</speaker>
    <linestext keyword="垃圾桶">
     不是的，胡图图是从垃圾桶捡来的。
    </linestext>
    </lines>    
    <lines lines_id="2">
    <speaker>胡图图</speaker>
    <linestext keyword="绝对">
     绝对？壮壮哥哥绝对是什么。
    </linestext>
    </lines>    
   </linestable>
  </plot>
  <frames frames_classifier="萌系">
   小美，胡图图和壮壮讨论自己是怎么来的。非常天真可爱。
  </frames>
 </section>
 
<section section_id="40">
 <!--40 编写人：邹仕艺-->
  <origin country="中国">
   <anime anime_name="大耳朵图图">
    <anime_content>第一季第2集</anime_content>
    <producer producer_name=" 上海美术电影制片厂">腾讯视频</producer>
   </anime>
   <original form="漫画">
    <author author_name="速达" author_gender="男" author_birth="1983-12-18"/>
   </original>
  </origin>
  <roletable>
   <role role_name="胡图图" role_gender="男" role_age="3" role_cv="豆豆" />
    狗熊
  </roletable>
  <plot plot_classifier="日常">
   <plot_content>    图图过生日，家人问他想要什么礼物，图图的答案出人意料__想要一个哥哥。爸爸妈妈心知儿子的孤单，想了各种解决问题的办法，最后爸爸从乡下爷爷那儿抱来了一只可爱的小花猫，图图给不爱吃鱼爱吃蔬菜的小猫取名小怪，并度过了一个快乐的生日。
   </plot_content>
   <linestable>
    <lines lines_id="1">
    <speaker>胡图图</speaker>
    <linestext keyword="生日">
     生日？是不是要吃好吃的东西呀？
    </linestext> 
    </lines>
   </linestable>
  </plot>
  <frames frames_classifier="萌系">
   当胡图图爸爸问胡图图过生日的时候想要什么，胡图图得知生日可以吃很多好吃的，非常兴奋可爱。
  </frames>
 </section>
 
</root>
 
